smartctl 7.1 2019-12-30 r5022 [x86_64-linux-5.8.0-25-generic] (local build)
Copyright (C) 2002-19, Bruce Allen, Christian Franke, www.smartmontools.org

=== START OF INFORMATION SECTION ===
Device Model:     CV1-MB512LIT
Serial Number:    AA000000000000001679
LU WWN Device Id: 5 000000 000000000
Firmware Version: P0223B
User Capacity:    480,103,981,056 bytes [480 GB]
Sector Size:      512 bytes logical/physical
Rotation Rate:    Solid State Device
Device is:        Not in smartctl database [for details use: -P showall]
ATA Version is:   ACS-2 (minor revision not indicated)
SATA Version is:  SATA 3.1, 6.0 Gb/s (current: 1.5 Gb/s)
Local Time is:    Thu Mar 25 14:47:54 2021 CST
SMART support is: Available - device has SMART capability.
SMART support is: Enabled

=== START OF READ SMART DATA SECTION ===
SMART overall-health self-assessment test result: PASSED

General SMART Values:
Offline data collection status:  (0x00)	Offline data collection activity
					was never started.
					Auto Offline Data Collection: Disabled.
Self-test execution status:      (   0)	The previous self-test routine completed
					without error or no self-test has ever 
					been run.
Total time to complete Offline 
data collection: 		(    0) seconds.
Offline data collection
capabilities: 			 (0x71) SMART execute Offline immediate.
					No Auto Offline data collection support.
					Suspend Offline collection upon new
					command.
					No Offline surface scan supported.
					Self-test supported.
					Conveyance Self-test supported.
					Selective Self-test supported.
SMART capabilities:            (0x0002)	Does not save SMART data before
					entering power-saving mode.
					Supports SMART auto save timer.
Error logging capability:        (0x01)	Error logging supported.
					General Purpose Logging supported.
Short self-test routine 
recommended polling time: 	 (   1) minutes.
Extended self-test routine
recommended polling time: 	 (   1) minutes.
Conveyance self-test routine
recommended polling time: 	 (   1) minutes.
SCT capabilities: 	       (0x003d)	SCT Status supported.
					SCT Error Recovery Control supported.
					SCT Feature Control supported.
					SCT Data Table supported.

SMART Attributes Data Structure revision number: 1
Vendor Specific SMART Attributes with Thresholds:
ID# ATTRIBUTE_NAME          FLAG     VALUE WORST THRESH TYPE      UPDATED  WHEN_FAILED RAW_VALUE
  1 Raw_Read_Error_Rate     0x0000   100   100   000    Old_age   Offline      -       0
  5 Reallocated_Sector_Ct   0x0000   100   100   000    Old_age   Offline      -       484
  9 Power_On_Hours          0x0000   100   100   000    Old_age   Offline      -       7818
 12 Power_Cycle_Count       0x0000   100   100   000    Old_age   Offline      -       133
160 Unknown_Attribute       0x0000   100   100   000    Old_age   Offline      -       1014
161 Unknown_Attribute       0x0000   100   100   000    Old_age   Offline      -       180
163 Unknown_Attribute       0x0000   100   100   000    Old_age   Offline      -       48
164 Unknown_Attribute       0x0000   100   100   000    Old_age   Offline      -       263140
165 Unknown_Attribute       0x0000   100   100   000    Old_age   Offline      -       254
166 Unknown_Attribute       0x0000   100   100   000    Old_age   Offline      -       76
167 Unknown_Attribute       0x0000   100   100   000    Old_age   Offline      -       131
168 Unknown_Attribute       0x0000   100   100   000    Old_age   Offline      -       3000
169 Unknown_Attribute       0x0000   100   100   000    Old_age   Offline      -       96
175 Program_Fail_Count_Chip 0x0000   100   100   000    Old_age   Offline      -       0
176 Erase_Fail_Count_Chip   0x0000   100   100   000    Old_age   Offline      -       0
177 Wear_Leveling_Count     0x0000   100   100   050    Old_age   Offline      -       777
178 Used_Rsvd_Blk_Cnt_Chip  0x0000   100   100   000    Old_age   Offline      -       42
181 Program_Fail_Cnt_Total  0x0000   100   100   000    Old_age   Offline      -       0
182 Erase_Fail_Count_Total  0x0000   100   100   000    Old_age   Offline      -       0
192 Power-Off_Retract_Count 0x0000   100   100   000    Old_age   Offline      -       36
194 Temperature_Celsius     0x0000   100   100   000    Old_age   Offline      -       40
195 Hardware_ECC_Recovered  0x0000   100   100   000    Old_age   Offline      -       3962
196 Reallocated_Event_Count 0x0000   100   100   016    Old_age   Offline      -       1276
197 Current_Pending_Sector  0x0000   100   100   000    Old_age   Offline      -       0
198 Offline_Uncorrectable   0x0000   100   100   000    Old_age   Offline      -       1115
199 UDMA_CRC_Error_Count    0x0000   100   100   050    Old_age   Offline      -       51
232 Available_Reservd_Space 0x0000   100   100   000    Old_age   Offline      -       81
241 Total_LBAs_Written      0x0000   100   100   000    Old_age   Offline      -       929085
242 Total_LBAs_Read         0x0000   100   100   000    Old_age   Offline      -       2168415
245 Unknown_Attribute       0x0000   100   100   000    Old_age   Offline      -       2105120

SMART Error Log Version: 1
No Errors Logged

SMART Self-test log structure revision number 1
No self-tests have been logged.  [To run self-tests, use: smartctl -t]

SMART Selective self-test log data structure revision number 1
 SPAN  MIN_LBA  MAX_LBA  CURRENT_TEST_STATUS
    1        0        0  Not_testing
    2        0        0  Not_testing
    3        0        0  Not_testing
    4        0        0  Not_testing
    5        0        0  Not_testing
    6        0    65535  Read_scanning was never started
Selective self-test flags (0x0):
  After scanning selected spans, do NOT read-scan remainder of disk.
If Selective self-test is pending on power-up, resume after 0 minute delay.

